processId,id,filename,title,DOCTYPE,DATE,STATES,AGENCY
1001088.0,3013,EisDocument-UOFA-01117,Dean Project Area Proposes to Implement Multiple Resource Management Actions Black Hills National Forest Bearlodge Ranger District Sundance Crook County WY,Final,June 2005,WY,Forest Service
1001205.0,3323,EisDocument-UOFA-01168,Driftless Area National Wildlife Refuge Comprehensive Conservation Plan To Recover and Conserve the Northern Monkshood and Iowa Pleistocene Snail IA,Draft,June 2005,IA,Fish and Wildlife Service
1002722.0,7479,EisDocument-UOFA-01299,McSutten Decision Area Implementation of Harvest and Associated Activities Prescribed Burning and Road Management Kootenai National Forest Rexford Ranger District Lincoln County MT,Final,June 2005,MT,Forest Service
1003323.0,9021,EisDocument-UOFA-00881,Ojo Caliente Proposed Transmission Line Propose to Authorize Construct Operate and Main tain a New 115kV Transmission Line and Substation Carson National Forest and BLM Taos Field Office Taos and Rio Arriba Counties NM,Final,June 2005,NM,Forest Service
1004003.0,10982,EisDocument-UOFA-01997,San Luis Drainage Feature Re-evaluation Project Provide Agricultural Drainage Service to the San Luis Unit Several Counties CA,Draft,June 2005,CA,Bureau of Reclamation
1004680.0,12841,EisDocument-UOFA-02015,Trunk Highway 23 Improvements Project From 0.25 Miles West of CSAH 6 in Kandiyohi County to 0.3 Miles Southwest of CSAH 123 Stearns County City of Paynesville Kandiyohi and Stearns Counties MN,Draft,June 2005,MN,Federal Highway Administration
1001022.0,2843,EisDocument-UOFA-01166,Creeks Forest Health Recovery Project To Develop a Network of Defensible Fuel Profile Zones (DFPZs) Group-Selection Timber Harvest Individual Tree Selection Lassen National Forest Almanor Ranger District Plumas County CA,Draft,May 2005,CA,Forest Service
1002313.0,6299,EisDocument-UOFA-01889,KeySpan Liquefied Natural Gas (LNG) Facility Upgrade Project Construction and Operation and Algonquin Gas Transmission Project Proposal for Site Construct and Operate a New Natural Gas Pipeline Coast Guard Permit US Army COE Section 10 and 404 Permits Providence County RI and New England,Final,May 2005,RI,Federal Energy Regulatory Commission
1002955.0,8018,EisDocument-UOFA-01221,Mountain Lake Fisheries Management Plan for the North Cascades National Service Complex Implementation North Cascades National Park Whatcom Skagit and Chelan Counties WA,Draft,May 2005,WA,National Park Service
1003979.0,10918,EisDocument-UOFA-00369,San Diego Range Allotment Project Proposes to Revise Grazing Program Santa Fe National Forest Jemez Ranger District Township 17-19 North Range 1-3 East Sandoval County NM,Final,May 2005,NM,Forest Service
1005096.0,14060,EisDocument-UOFA-01945,Weaver's Cove Liquefied Natural Gas (LNG) Project Construct and Operate Onshore Liquefied Natural Gas Import and Interstate Natural Gas Transmission Facilities Falls River Bristol County MA,Final,May 2005,MA,Federal Energy Regulatory Commission
1000559.0,1637,EisDocument-UOFA-00845,Burr Trail Modification Project Proposed Road Modification within Capitol Reef National Park Garfield County UT,Draft,May 2005,UT,National Park Service
1001349.0,3721,EisDocument-UOFA-01253,Empire Vegetation Management Project Reducing Fire Hazards Harvesting of Trees Using Group-Selection (GS) and Individual Trees Selection (ITS) Methods Mt. Hough Ranger District Plumas National Forest Plumas County CA,Draft,May 2005,CA,Forest Service
1001825.0,4996,EisDocument-UOFA-00469,Growden Dam Sherman Creek Restoration Project and Forest Plan Amendment #28 Implementation Colville National Forest Ferry County WA,Draft,May 2005,WA,Forest Service
1002692.0,7403,EisDocument-UOFA-01682,Martin Run Project To Implement Management Direction as Outlined in Allegheny National Forest Plan Bradford Ranger District Allegheny National Forest Warren and McKean Counties PA,Final,May 2005,PA,Forest Service
1003228.0,8751,EisDocument-UOFA-01465,North Valleys Rights-of-Way Projects Proposed Construction and Operation of Water Transmission Pipelines Washoe County NV,Draft,May 2005,NV,Bureau of Land Management
,14052,EisDocument-UOFA-00589,Watts Bar Reservoir Land Management Plan Update 1988 Plan to Reflect Changing Community Needs Loudon Meigs Rhea and Roane Counties TN,Draft,May 2005,TN,Tennessee Valley Authority
1001151.0,3172,EisDocument-UOFA-00425,Detroit Intermodal Freight Terminal (DIFT) Project Proposes Improvement to Intermodal Freight Terminals in Wayne and Oakland Counties MI,Draft,May 2005,MI,Federal Highway Administration
1001442.0,3974,EisDocument-UOFA-01590,Finger Lakes National Forest Project Proposed Land and Resource Management Plan Forest Plan Revision Implementation Seneca and Schuyler Counties NY,Draft,May 2005,NY,Forest Service
1001642.0,4395,EisDocument-UOFA-00022,GENERIC - Donald C. Cook Nuclear Plant Units No. 1 and 2 (TAC No. MC1221 and MC1222) License Renewal Supplement 20 to NUREG 1437 Berrien County MI,Final,May 2005,MI,Nuclear Regulatory Commission
1004562.0,12532,EisDocument-UOFA-03306,The Town of Bloomsburg Columbia County Pennsylvania Flood Damage Reduction Project Implementation Integrated Feasibility Report Susquhanna River and Fishing Creek Town of Bloomsburg Columbia County PA,Draft,May 2005,PA,U.S. Army Corps of Engineers
,13573,EisDocument-UOFA-00707,Upper Mississippi National Wildlife and Fish Refuge Comprehensive Conservation Plan (CCP) Implementation MN WI IL and IA,Draft,May 2005,MN,Fish and Wildlife Service
1000655.0,1899,EisDocument-UOFA-02024,Campus Parkway Project Proposes to Construct a New Expressway from Mission Avenue Interchange and Yosemite Avenue/Lake Road US Army COE Section 404 Permit City of Merced Merced County CA,Draft,May 2005,CA,Federal Highway Administration
250.0,2519,EisDocument-UOFA-00427,Coconino National Forest Project Re-authorize Grazing on the Pickett Lake and Padre Canyon Allotments Implementation Mormon Lake Range District Coconino County AZ,Draft,May 2005,AZ,Forest Service
483.0,4479,EisDocument-UOFA-00217,Gallatin National Forest Updated Information Main Boulder Fuels Reduction Project Implementation Gallatin National Forest Big Timber Ranger District Big Timber Sweethgrass and Park Counties MT,Draft Supplement,May 2005,MT,Forest Service
1002035.0,5557,EisDocument-UOFA-00375,I-49 South Lafayette Regional Airport to LA-88 Route US-90 Project Upgrading Existing US-90 from the Lafayette Regional Airport to LA-88 Funding Iberia Lafayette and St. Martin Parishes LA,Final,May 2005,LA,Federal Highway Administration
1002253.0,6149,EisDocument-UOFA-02040,Juneau International Airport Proposed Development Activities to Enhance Operations Safety Facilitate Aircraft Alignment US Army COE Section 404 Permit City and Borough of Juneau AK,Draft,May 2005,AK,Federal Aviation Administration
1002846.0,7763,EisDocument-UOFA-00149,Mission Brush Project Additional Information Proposes Vegetation Wildlife Habitat Recreation and Aquatic Improvement Treatments Idaho Panhandle National Forests Bonners Ferry Ranger District Bounty County ID,Draft Supplement,May 2005,ID,Forest Service
2000833.0,9809,EisDocument-UOFA-02047,Piceance Basin Expansion Project Construction and Operation of a New Interstate Natural Gas Pipeline System Wamsutter Compressor Station to Interconnections Greasewood Compressor Station Rio Blanco County CO and Sweetwater County WY,Draft,May 2005,CO,Federal Energy Regulatory Commission
1004083.0,11187,EisDocument-UOFA-01612,Seabird Interaction Mitigation Methods To Reduce Interaction with Seabird in Hawaii-Based Longline Fishery and Pelagic Squid Fishery Management to Establish an Effective Management Framework for Pelagic Squid Fisheries Fishery Management Plan Pelagic Fisheries of the Western Pacific Region Exclusive Economic Zone of the U.S. and High Sea HI,Final,May 2005,HI,National Oceanic and Atmospheric Administration
1000239.0,779,EisDocument-UOFA-01075,Aspen Range Timber Sale and Vegetation Treatment Project Proposal to Treat Forested and Nonforested Vegetation Caribou-Targhee National Forest Soda Springs Ranger District Caribou County ID,Draft,April 2005,ID,Forest Service
1001497.0,4113,EisDocument-UOFA-00986,Folsom Dam Road Access Restriction Project Control Access to Folsom Dam City of Folsom CA,Final,April 2005,CA,Bureau of Reclamation
1002798.0,7645,EisDocument-UOFA-01691,Middle East Fork Hazardous Fuel Reduction Project Implementation of Three Alternatives Bitterroot National Forest Sula Ranger District Ravalli County MT,Draft,April 2005,MT,Forest Service
1003012.0,8239,EisDocument-UOFA-01447,National Institutes of Health (NIH) Master Plan 2003 Update National Institutes of Health Main Campus - Bethesda MD Montgomery County MD,Final,April 2005,MD,National Institute of Health
2000842.0,9902,EisDocument-UOFA-01346,Plentybob Ecosystem Restoration Project Restoration Activities Include: Prescribed Fire Timber Harvest Road Obliteration Hardwood Planting and Noxious Weed Treatment Implementation Walla Walla Ranger District Umatilla National Forest Umatilla County OR,Final,April 2005,OR,Forest Service
1389.0,10052,EisDocument-UOFA-00637,Powder River Basin Expansion Project New Information on SEA's Independent Analyses Four Issues Remanded by the '8' Circuit Court of Appeals Finance Docket No. 33407 - Dakota Minnesota Eastern Railroad SD WY and MN,Draft Supplement,April 2005,SD,Surface Transportation Board
1004212.0,11533,EisDocument-UOFA-00616,Snow Talon Fire Salvage Project Proposes to Salvage Harvest Trees Burned in the Fire Helena National Forest Lincoln Ranger District Lewis and Clark County MT,Final,April 2005,MT,Forest Service
1004332.0,11837,EisDocument-UOFA-00754,Southern Corridor Construction I-15 at Reference Post 2 in St. George to UT-9 near Hurricane Funding Right-of-Way Grant and US Army COE Section 404 Permit Issuance St. George Washington and Hurricane Washington County UT,Final,April 2005,UT,Federal Highway Administration
1005027.0,13773,EisDocument-UOFA-01302,Vista del Sol Liquefied Natural Gas (LNG) Terminal Project Construct Install and Operate and LNG Terminal and Natural Gas Pipeline Facilities Vista del Sol LNG Terminal LP and Vista del Sol Pipeline LP TX,Final,April 2005,TX,Federal Energy Regulatory Commission
1000152.0,572,EisDocument-UOFA-00387,American and Crooked Rivers Project Improve Forest Health and Reduce Hazardous Fuels Implementation Nez Perce National Forest Red River Ranger District Idaho County ID,Final,April 2005,ID,Forest Service
1003669.0,9354,EisDocument-UOFA-00324,PROGRAMMATIC - Mars Exploration Program (MEP) Implementation,Final,April 2005,,National Aeronautics and Space Administration
1004898.0,13181,EisDocument-UOFA-01955,US 41 Highway Corridor Project Transportation Improvement between the Cities of Oconto and Peshtigo Funding Marinette and Oconto Counties WI,Draft,April 2005,WI,Federal Highway Administration
2001186.0,13748,EisDocument-UOFA-00440,Vicksburg Campaign Trail (VCT) Feasibility Study To Examine and Evaluate a Number of Sites Implementation Mississippi River AR LA TN MS and KY,Final,April 2005,AR;LA;TN;MS;KY,National Park Service
5000005.0,3608,EisDocument-UOFA-01616,Eglin Air Force Base and Hurlburt Field Military Family Housing Demolition Construction Renovation and Leasing (DCR&L) Program Okaloosa County FL,Draft,April 2005,FL,United States Air Force
1002050.0,5594,EisDocument-UOFA-00581,I-69 Corridor - Section of Independent Utility (SIU) No. 14 Construction from Junction 1-20 near Haughton LA to US 82 near EL Dorado AR Bossier Claiborne and Webster Parishes LA and Columbia and Union Counties AR,Draft,April 2005,AR,Federal Highway Administration
1003678.0,9370,EisDocument-UOFA-01798,PROGRAMMATIC - Montrose Settlements Restoration Program (MSRP) Draft Restoration Plan To Restore Injured Natural Resources Channel Islands Southern California Bight including Baja California Pacific Islands Orange County CA,Draft,April 2005,CA,National Oceanic and Atmospheric Administration
1000490.0,1466,EisDocument-UOFA-01627,Boulder City/US 93 Corridor Transportation Improvements Study Limits are between a western boundary on US 95 in the City of Henderson and an eastern boundary on US 93 west of downtown Boulder City NPDES and US Army COE Section 404 Permits Issuance and Right-of-Way Grant Clark County NV,Final,April 2005,NV,Federal Highway Administration
2000175.0,1990,EisDocument-UOFA-00470,Caribou Travel Plan Revision Determine the Motorized Road and Trail System Implementation Caribou-Targhee National Forest Westside Soda Spring and Montpelier Ranger Districts Bannock Bear River Bonneville Caribou Franklin Oneida and Power Counties ID; Box Elder and Cache Counties UT and Lincoln County WY,Draft,April 2005,ID,Forest Service
1001208.0,3329,EisDocument-UOFA-01289,Dry Fork Federal Coal Lease-by-Application (COC-67232) Leasing Additional Federal Coal Lands for Underground Coal Resource Special-Use-Permits and US Army COE Section 404 Permit Grand Mesa Uncompahgre and Gunnison National Forests Gunnison County CO,Draft,April 2005,CO,Forest Service
1001217.0,3348,EisDocument-UOFA-00396,Duck Creek Fuels Treatment Analysis To Reduce Fuels Enhance Fire-Tolerant Vegetation and Provide Fuel Breaks Dixie National Forest Cedard City Ranger District Kane County UT,Final,April 2005,UT,Forest Service
1001793.0,4908,EisDocument-UOFA-00979,Green Mountain National Forest Propose Revised Land and Resource Management Plan Implementation Forest Plan Revision Addison Bennington Rutland Washington Windham and Windsor Counties VT,Draft,April 2005,VT,Forest Service
2000480.0,5286,EisDocument-UOFA-00958,Herbert Hoover Dike Major Rehabilitation Evaluation Study Proposed to Reduce the Probability of a Breach of Reach One Lake Okeechobee Martin and Palm Beach Counties FL,Draft Supplement,April 2005,FL,U.S. Army Corps of Engineers
3000066.0,8222,EisDocument-UOFA-00591,National Emerging Infectious Disease Laboratories Additional Information on Two Alternatives Construction of National Biocontainment Laboratory BioSquare Research Park Boston University Medical Center Campus Boston MA,Draft Supplement,April 2005,MA,National Institute of Health
,12788,EisDocument-UOFA-00568,Tri-County Parkway Location Study Construction of a New North-South Transportation Link to Connect the City of Manassas with I-66 Funding and US COE Section 404 Permit Prince William Fairfax and Loudoun Counties VA,Draft,April 2005,VA,Federal Highway Administration
1005094.0,14056,EisDocument-UOFA-00326,Wayne National Forest Proposed Revised Land and Resource Management Plan Implementation Several Counties OH,Draft,April 2005,OH,Forest Service
1005125.0,14141,EisDocument-UOFA-02455,West Mojave Plan Habitat Conservation Plan and Federal Land Use Plan Amendment Implementation California Desert Conservation Area Portion of San Bernardino Kern Inyo and Los Angeles Counties CA,Final,April 2005,CA,Bureau of Land Management
1000332.0,1024,EisDocument-UOFA-01145,Baylor Park Blowdown Project New Information Salvage and Treat Down and Damaged Timber To Reduce Impact of Spruce Beetles Implementation White River National Forest Sopris and Rifle Ranger Districts Garfield Mesa and Pitkin Counties CO,Draft Supplement,March 2005,CO,Forest Service
1001346.0,3712,EisDocument-UOFA-01851,Emigrant Mine Project Develop and Operate an Open Pit Mine Construct a Waste Rock Disposal Facility South of Carlin in Elko County NV,Draft,March 2005,NV,Bureau of Land Management
2000393.0,4420,EisDocument-UOFA-00018,GENERIC - License Renewal of Nuclear Plants Joseph M. Farley Nuclear Plants Units 1 and 2 Supplemental 18 to NUREG-1437 (TAC NOS. MC0768 and MC0769; Houston County AL,Final Supplement,March 2005,AL,Nuclear Regulatory Commission
1001932.0,5308,EisDocument-UOFA-00896,Hiawatha National Forest Proposed Land and Resource Management Plan Forest Plan Revision Implementation Alger Cheboygan Chippewa Delta Luce Mackinac Marquette and Schoolcraft Counties MI,Draft,March 2005,MI,Forest Service
1001972.0,5398,EisDocument-UOFA-01355,Hoosier National Forest Land and Resource Management Plan Implementation Brown Crawford Dubois Jackson Lawrence Martin Monroe Orange Perry Counties IN,Draft,March 2005,IN,Forest Service
1003239.0,8799,EisDocument-UOFA-01529,Northeast Yaak Project Proposed Harvest to Reduce Fuels in Old Growth Implementation Kootenai National Forest Three River Ranger District Lincoln County MT,Draft,March 2005,MT,Forest Service
1003354.0,9108,EisDocument-UOFA-01327,Ottawa National Forest Proposed Land and Resource Management Plan Forest Plan Revision Implementation Baraga Gogebic Houghton Iron Marquette and Ontonagan Counties MI,Draft,March 2005,MI,Forest Service
1003666.0,9339,EisDocument-UOFA-01382,PROGRAMMATIC - Lower Colorado River Basin Study Provide Flood Damage Reduction and Ecosystem Restoration Colorado River TX,Draft,March 2005,TX,U.S. Army Corps of Engineers
1003700.0,9430,EisDocument-UOFA-02192,PROGRAMMATIC - San Luis Obispo Creek Watershed Waterway Management Plan Stream Maintenance and Management Plan City of San Luis Obispo and County of San Luis Obispo Community of Avila Beach San Luis Obispo County CA,Draft,March 2005,CA,U.S. Army Corps of Engineers
1003576.0,10061,EisDocument-UOFA-01184,Power Fire Restoration Project To Reduce Long-Term Furel Loading for the Purpose of Reducing Future Severity and Resistance to Control Amador Ranger District Eldorado National Forest Amador County CA,Draft,March 2005,CA,Forest Service
2000981.0,10832,EisDocument-UOFA-00850,Sahuarita-Nogales Transmission Line Construction and Operation of a 345 00-volt (345 kV) Electric Transmission Line across the United States Border with Mexico Application for Presidential Permit Tucson Electric Power (TEP Nogales AZ,Final,March 2005,AZ,Department of Energy
1004194.0,11473,EisDocument-UOFA-01537,Sloan Canyon National Conservation Area Resource Management Plan Implementation Cities of Las Vegas and Henderson Clark County NV,Draft,March 2005,NV,Bureau of Land Management
2001031.0,11587,EisDocument-UOFA-00193,South Atlantic Shrimp Fishery Management Plan Amendment 6 Propose to Amend the Bycatch Reduction Device (BRD) Testing Protocal System South Atlantic Region,Final Supplement,March 2005,,National Oceanic and Atmospheric Administration
1000408.0,1222,EisDocument-UOFA-00528,Big Butte Springs Timber Sales To Implementation Management Direction Roque River-Siskiyou National Forest Butte Falls Ranger District Cascade Zone Jackson County OR,Draft,March 2005,OR,Forest Service
1001727.0,4700,EisDocument-UOFA-02026,Golden Gate National Recreation Area (GGNRA) Fire Management Plan Implementation Muir Woods National Monument Fort Point National Historic Site San Mateo San Francisco and Marin Counties CA,Draft,March 2005,CA,National Park Service
1002694.0,7408,EisDocument-UOFA-02105,Marysville Hotel Demolition Project Proposed Acquisition and Demolition of Building City of Marysville Yuba County CA,Final,March 2005,CA,Department of Housing and Urban Development
1002817.0,7695,EisDocument-UOFA-00962,Mill Creek Ohio Flood Damage Reduction Project To Reduce Damages to Communities Hamilton County OH,Final,March 2005,OH,U.S. Army Corps of Engineers
1004126.0,11295,EisDocument-UOFA-01054,Shawnee National Forest Proposed Land and Resource Management Plan Revision Implementation Alexander Gallatin Hardin Jackson Johnson Massac Pope Union and Williamson Counties IL,Draft,March 2005,IL,Forest Service
1004130.0,11303,EisDocument-UOFA-01699,Sheep Creek Salvage Project Moving Current Resource Conditions and Trends Toward Desired Future Conditions Beaverhead-Deerlodge National Forest Beaverhead County MT,Final,March 2005,MT,Forest Service
1005098.0,14064,EisDocument-UOFA-00595,Weber County to Salt Lake City Commuter Rail Project Proposes a Commuter Rail Transit Service with Nine Stations between Salt Lake City and Peasant View Funding Weber Davis and Salt Lake Counties UT,Final,March 2005,UT,Federal Transit Administration
1000675.0,1942,EisDocument-UOFA-02244,Capacity Replacement Project Construction and Operation of 79 5 miles Pipeline; Modify 5 Existing Compressor Stations US Army COE 10 and 404 Permits Whatcom Skagit Snohomish King Pierce and Thurston Counties WA,Draft,March 2005,WA,Federal Energy Regulatory Commission
2000589.0,6682,EisDocument-UOFA-01079,Lemolo Watershed Projects Updated and New Infomation Concerning Recommendeds Steamed from the Diamond Lake/Lemolo Lake Watershed Analysis (WA) Implementation Umpqua National Forest Diamond Lake Ranger District Douglas County OR,Final,March 2005,OR,Forest Service
1002557.0,6955,EisDocument-UOFA-01582,Los Banos Bypass Project Construct from CA-152 in Merced County beginning near Volta Road west to Los Banos bypassing Los Banos ending near the Santa Fe Grade Road US Army COE Section 404 Permit Merced County CA,Draft,March 2005,CA,Federal Highway Administration
2000628.0,7077,EisDocument-UOFA-00560,Lower Snake River Navigation Maintenance To Perform Routine Maintenance of the Federal Navigation Channel and Berthing Areas Lower Snake and Clearwater Rivers WA and ID,Draft,March 2005,WA,U.S. Army Corps of Engineers
1003457.0,9744,EisDocument-UOFA-01848,Petersburg National Battlefield General Management Plan Implementation Petersburg VA,Final,March 2005,VA,National Park Service
1003471.0,9782,EisDocument-UOFA-00286,Philadelphia International Airport Runway 17-35 Extension Project Construction and Operation US Army COE Section 404 Permit NPDES Permit Delaware and Philadelphia Counties PA,Final,March 2005,PA,Federal Aviation Administration
2000930.0,10386,EisDocument-UOFA-01911,Reef Fish Fishery Management Plan (FMP) Amendment 23 to Set Vermilion Snapper Sustainable Fisheries Act Targets and Thresholds and to Establish a Plan to End Overfishing and Rebuild the Stock Implementation Gulf of Mexico,,March 2005,,National Oceanic and Atmospheric Administration
2000970.0,10731,EisDocument-UOFA-00090,Ruby Hill Mine Expansion - East Archimedes Project Extension of Existing Open Pit and Exansion of Two Existing Waste Rock Disposal Areas Plan-of-Operations Permit Eureka County NV,Draft Supplement,March 2005,NV,Bureau of Land Management
1004402.0,12039,EisDocument-UOFA-02155,Stanislaus Rivers Projects Relicensing of Hydroelectric Projects: Spring Gap-Stanislaus FERC NO. 2130; Beardsley/Donnells FERC No. 2005; Tulloch FERC No. 2067; and Donnells-Curtis Transmission Line FERC No. 2118 Tuolumne and Calaveras Counties CA,Final,March 2005,CA,Federal Energy Regulatory Commission
1005067.0,13973,EisDocument-UOFA-00461,Warm Springs Extension Proposing 5.4 mile Extension of the BART System in the City of Fremont Funding San Francisco Bay Area Rapid Transit District Alameda County CA,Draft,March 2005,CA,Federal Transit Administration
1000283.0,892,EisDocument-UOFA-00643,B&B Fire Recovery Project Proposed Harvest of Fire-Killed Trees Reduction of Fuels Planting of Tree Deschutes National Forest Sister Ranger District Jefferson and Deschutes Counties OR,Draft,March 2005,OR,Forest Service
1000995.0,2779,EisDocument-UOFA-01594,Cottonwood Fire Vegetation Management Project Control Vegetation that is Competing with Conifer Seedlings Sierraville Ranger District Tahoe National Forest Sierra County CA,Final,March 2005,CA,Forest Service
1000030.0,75,EisDocument-UOFA-01896,1st Street Viaduct and Street Widening Project To Replace Two Traffic Lanes on the 1st Street Viaduct between Vignes Street and Mission Road Funding in the City and County of Los Angeles CA,Draft,February 2005,CA,Federal Highway Administration
2000080.0,829,EisDocument-UOFA-01680,Atlantic Large Whale Take Reduction Plan Proposed Amendments to Implement Specific Gear Modifications for Trap/Pot and Gillnet Fishereries Broad--Based Gear Modifications Exclusive Economic Zone (EEZ) ME CT and RI,Draft,February 2005,,National Oceanic and Atmospheric Administration
2000267.0,2883,EisDocument-UOFA-01993,Crown Landing Liquefied Natural Gas Terminal Construct and Operate in Gloucester County NJ and New Castle County DE; and Logan Lateral Project Construct and Operate a New Natural Gas Pipeline and Ancillary Facilities in Gloucester County NJ and Delaware PA,Draft,February 2005,,Federal Energy Regulatory Commission
1002075.0,5671,EisDocument-UOFA-01882,I-94/Rehabilitation Project Tranportation Improvements to a 6.7 mile portion of I-94 from east I-96 west and to Conner Avenue on the east end Funding and NPDES Permit City of Detroit Wayne County MI,Final,February 2005,MI,Federal Highway Administration
1002275.0,6212,EisDocument-UOFA-00270,Kansas Lane Connector Project Construction between US 90 (Desiard Street) and US 165 and the Forsythe Avenue Extension US Army COE Section 10 and 404 Permits Issuance City of Monroe Quachita Parish LA,Final,February 2005,LA,Federal Highway Administration
1003094.0,8417,EisDocument-UOFA-00316,New Horizons Mission to Pluto Continued Preparations and Implementation to Explore Pluto and Potentially the Recently Discovered Kuiper Belt Cape Canaveral Air Force Station FL,Draft,February 2005,FL,National Aeronautics and Space Administration
1003178.0,8612,EisDocument-UOFA-01505,North Belts Travel Plan and the Dry Range Project Provision of Motorized and Non-motorized Recreation Helena National Forest Broadwater Lewis and Clark and Meagher Counties MT,Final,February 2005,MT,Forest Service
1004738.0,12969,EisDocument-UOFA-00686,U.S. 101/Oregon Coast Highway Reconstruction Pacific Way in the City of Gerhart to Dooley Bridge in the City of Seaside Funding and COE Section 404 Permit Clatsop County OR,Final,February 2005,OR,Federal Highway Administration
1000733.0,2083,EisDocument-UOFA-00574,Cedar Bayou Navigation Channel (CBNC) Improvement Project Implementation Near Baytown in Harris and Chambers Counties TX,Draft,February 2005,TX,U.S. Army Corps of Engineers
